address,full_address,subdistrict_name,lat,lng,name九龍偉業街33號德福廣場1期地下客戶服務中心,九龍灣偉業街33號德福廣場一期充電站,九龍灣,22.3222,114.2132,德福廣場一期九龍灣偉業街33號德福廣場二期三樓客戶服務中心,九龍灣偉業街33號德福廣場一期充電站,九龍灣,22.3222,114.2132,德福廣場一期九龍灣站大堂（近客服中心）,港鐵九龍灣站KOB10號舖(近陶大花園),九龍灣,22.324,114.214,7-11便利店-港鐵九龍灣站九龍灣站1號月台（近月台監察亭）,港鐵九龍灣站KOB10號舖(近陶大花園),九龍灣,22.324,114.214,7-11便利店-港鐵九龍灣站觀塘道199號牛頭角公園足球場入口,觀塘道   199號,牛頭角,22.3228,114.2153,牛頭角公園牛頭角兆業街9號牛頭角救護站正門入口外,牛頭角兆業街9號,九龍灣,22.3201,114.2122,牛頭角救護站九龍灣宏遠街1號一號九龍大堂禮賓部,九龍九龍灣宏遠街1號一號九龍28樓,九龍灣,22.3206,114.21,綠色星期一基金會有限公司九龍牛頭角道120號牛頭角下邨物業服務辦事處保安控制室,牛頭角道   120號,牛頭角,22.3215,114.2155,牛頭角下邨九龍灣宏照道33號北面大堂禮賓部,香港九龍灣宏照道38號企業廣場5期MegaBox一樓1至18、24至46號舖及二樓1至23、35至58號舖,九龍灣,22.3198,114.2085,AEON-九龍灣店九龍灣宏照道39號企業廣場3期一樓大堂接待處,九龍九龍灣宏照道39號企業廣場第3期30樓3005室,九龍灣,22.3197,114.2096,智利 - 總領事館九龍灣牛頭角道77號淘大商場停車場收費處（一期商場二樓）,九龍九龍灣牛頭角道77號淘大商場停車場一樓,九龍灣,22.3251,114.2163,淘大商場九龍牛頭角安德道1樓2號二樓詢問處（明愛牛頭角社區中心）,安德道   1號,牛頭角,22.321,114.2165,明愛牛頭角社區中心九龍灣宏照道38號企業廣場5期一座辦公大樓L1顧客服務中心,香港九龍灣宏照道38號企業廣場5期MegaBox一樓1至18、24至46號舖及二樓1至23、35至58號舖,九龍灣,22.3198,114.2085,AEON-九龍灣店九龍灣常悅道9號企業廣場三樓大堂接待處側,九龍九龍灣常悅道9號企業廣場一期1座1樓1&3號舖,九龍灣,22.322,114.2079,九龍灣郵政局九龍灣常悅道9號企業廣場第三座11樓接近貨用升降機大堂,九龍九龍灣常悅道9號企業廣場一期1座1樓1&3號舖,九龍灣,22.322,114.2079,九龍灣郵政局九龍牛頭角振華道20號安基商場地下大堂顧客服務中心,九龍牛頭角樂華邨展華樓141-150號地下,牛頭角,22.3211,114.2188,牛頭角服務中心九龍灣牛頭角道77號淘大商場2期1樓禮賓服務台,"九龍灣牛頭角道77 號淘大花園淘大商場一期1 樓F33-37, F38-40及F41-45 號舖",九龍灣,22.3248,114.2162,TASTE x FRESH新鮮生活-淘大商場九龍灣宏照道38號企業廣場5期MegaBox G樓顧客服務中心,香港九龍灣宏照道38號企業廣場5期MegaBox一樓1至18、24至46號舖及二樓1至23、35至58號舖,九龍灣,22.3198,114.2085,AEON-九龍灣店九龍灣宏照道38號企業廣場5期MegaBox L15保安辦公室,香港九龍灣宏照道38號企業廣場5期MegaBox一樓1至18、24至46號舖及二樓1至23、35至58號舖,九龍灣,22.3198,114.2085,AEON-九龍灣店九龍灣宏照道38號企業廣場5期MegaBox L9 顧客服務中心,香港九龍灣宏照道38號企業廣場5期MegaBox一樓1至18、24至46號舖及二樓1至23、35至58號舖,九龍灣,22.3198,114.2085,AEON-九龍灣店九龍灣啟祥道20號大昌行集團大廈地面,九龍灣啓祥道20號大昌行集團大廈地下,九龍灣,22.3249,114.2079,大昌貿易行汽車服務中心有限公司 - 車隊服務九龍灣啟樂街15號九龍灣體育館大堂,啓樂街   15號,九龍灣,22.3269,114.2116,九龍灣體育館九龍灣常悅道3號企業廣場2期一樓大堂接待處,香港九龍灣宏照道38號企業廣場5期MegaBox一樓1至18、24至46號舖及二樓1至23、35至58號舖,九龍灣,22.3198,114.2085,AEON-九龍灣店九龍灣啟樂街1號九龍灣運動場,九龍灣啟樂街1號,九龍灣,22.3265,114.2091,九龍灣運動場 A(室外)牛池灣公園,九龍黃大仙牛池灣豐盛街71號,牛池灣,22.3362,114.216,牛池灣公園(室外)九龍灣常悅道1號恩浩國際中心地下控制室,九龍九龍灣展貿徑1號九龍灣國際展貿中心停車場地庫二樓,九龍灣,22.323,114.2045,九龍灣國際展貿中心九龍灣臨華街1號地下報案室外,九龍灣臨華街1號九龍巴士九龍灣車廠地下,九龍灣,22.3237,114.2073,力成汽車維修有限公司九龍祥業街5號啟德消防局正門入口外,九龍祥業街5號,,22.3164,114.2112,啟德消防局九龍臨興街5號九龍灣消防局正門入口外,九龍臨興街5號,九龍灣,22.3244,114.2058,九龍灣消防局觀塘海濱道83號花旗大廈地下大堂保安控制室,九龍觀塘海濱道173號申新大廈地下,,22.3102,114.2198,ASTON MARTIN (HONG KONG)觀塘海濱道83號花旗大廈5樓 First Aid Room,九龍觀塘海濱道83號OneBayEastCitiTower一樓E4號舖,,22.3159,114.2142,7-11便利店-海濱道83號九龍牛頭角彩霞道10號佐敦谷遊樂場辦事處門外,九龍牛頭角佐敦谷遊樂場,佐敦谷,22.3245,114.2177,廁所(佐敦谷遊樂場附近)九龍灣啟禮道18號九龍灣公園,九龍灣啟禮道18號,九龍灣,22.3272,114.2072,九龍灣公園停車場(室外)九龍觀塘海濱道80號海濱花園急救室門外,九龍觀塘海濱道80號,,22.3097,114.2191,觀塘海濱花園 (指定位置)九龍灣承昌道1號香港兒童醫院A座,九龍九龍灣承昌道一號香港兒童醫院A座2樓C8﹒4﹒3室及B座3樓B﹒3﹒15室,啟德,22.3163,114.2082,香港紅十字會醫院學校 (小學部)彩德商場控制室,薄枎林置富南區廣場4樓(近控制室),置富,22.2579,114.1386,回收機構及收集點： 置富南區廣場香港兒童醫院B座,九龍灣承昌道一號香港兒童醫院B座1樓,啟德,22.3152,114.2092,遺傳輔導診所牛頭角振華道50號樂雅苑停車場頂樓,牛頭角振華道50號樂雅苑停車場頂樓,牛頭角,22.3224,114.2204,振華道體育館祥業街1號啟德海濱公園（香港兒童醫院段）,祥業街   1號,啟德,22.3153,114.2087,啟德海濱公園（香港兒童醫院段）海濱道公園近女洗手間及更衣室牆外,海濱道   85號,,22.3148,114.2157,海濱道公園觀塘彩榮路58號體育館地下簽場處,觀塘彩榮路58號,佐敦谷,22.3294,114.2165,彩榮路體育館九龍灣啟成街3號機電工程署地下大堂接待處,九龍灣啟成街3號機電工程署總部車輛部主廠,九龍灣,22.3259,114.2036,機電工程署 - 車輛工程分部 (九龍灣)九龍灣布衣格建築啟動豎井施工區飯堂B內，門口左邊,九龍長沙灣以馬內利浸信會區樹洪社會服務大樓,長沙灣,22.3345,114.1538,以馬內利浸信會牛頭角站大堂近客服中心,港鐵牛頭角站NTK13號舖(近B出口),,22.3156,114.219,7-11便利店-港鐵牛頭角站牛頭角站1號月台（近第四卡）,九龍牛頭角香港鐵路牛頭角站,,22.3155,114.219,港鐵牛頭角站觀塘新清水灣道20號坪石遊樂場訂場處,九龍牛頭角新清水灣道20號,牛池灣,22.3381,114.2102,坪石遊樂場觀塘偉業街108號絲寶國際大廈,九龍觀塘偉業街182號官塘碼頭廣場停車場六樓,,22.3092,114.2212,觀塘碼頭廣場觀塘道378號創紀之城二期1樓禮賓部,九龍觀塘觀塘道388號創紀之城1期 1座9樓915-918室,,22.3139,114.2213,地理空間實驗室觀塘康寧道180號康寧道公園訂場處,康寧道   180號,牛頭角,22.3199,114.2242,康寧道公園（第一期）康寧道康寧道遊樂場公園辦事處,康寧道公園（第一期）,牛頭角,22.3204,114.2246,康寧道公園(第一期)廁所新清水灣道71號佐敦谷公園公園辦事處外,新清水灣道   71號,順利邨,22.3299,114.2212,佐敦谷公園觀塘道388號創紀之城一期地下客戶服務中心,九龍觀塘觀塘道388號創紀之城一期地下2B舖,,22.3138,114.2211,7-11便利店-創紀之城觀塘道392號創紀之城6期1樓大堂,九龍觀塘觀塘道392號創紀之城6期21樓,,22.3133,114.222,觀塘民政事務處牛池灣消防局正門入口外,鴨脷洲消防局,鴨脷洲,22.2433,114.1522,鴨脷洲消防局清水灣道11號3樓牛池灣市政大廈走廊近前台辦事處,清水灣道   11號,牛池灣,22.3346,114.2093,牛池灣市政大廈觀塘秀雅道遊樂場上場臨時公園辦事處,九龍觀塘月華街遊樂場,觀塘,22.3154,114.2265,月華街遊樂場彩虹站4號月台（近第四卡）,九龍牛池灣香港鐵路彩虹站,牛池灣,22.3355,114.2075,港鐵彩虹站-C4進出口彩虹站1號月台近第四卡,九龍牛池灣香港鐵路彩虹站,牛池灣,22.3355,114.2075,港鐵彩虹站-C4進出口彩虹站大堂近客服中心,九龍牛池灣香港鐵路彩虹站,牛池灣,22.3341,114.2096,港鐵彩虹站-A1進出口瑞和街9號瑞和市政大廈8樓至9樓大堂,觀塘瑞和街9號瑞和市政大廈8樓及9樓,觀塘,22.3157,114.2243,瑞和街體育館觀塘順利安道32號順利紀律部隊宿舍平台穿梭升降機大堂,九龍觀塘利安道32號順利紀律部隊宿舍第二層平台第1號舖,順利邨,22.332,114.2217,7-11便利店-順利紀律部隊宿舍順利消防局正門入口外,九龍觀塘利安道33號,順利邨,22.3313,114.2227,順利消防局駿業街遊樂場場地辦事處門外,九龍觀塘月華街遊樂場,觀塘,22.3154,114.2265,月華街遊樂場協和街130號基督教聯合醫院P座地下,九龍觀塘協和街130號基督教聯合醫院P座1樓,秀茂坪,22.3233,114.227,基督教聯合醫院(精神科)協和街130號基督教聯合醫院S座地下,九龍觀塘協和街130號基督教聯合醫院P座1樓,秀茂坪,22.3233,114.227,基督教聯合醫院(精神科)順利邨道33號順利邨體育館救護室外,九龍觀塘順利邨道33號順利邨體育館三樓,順利邨,22.3297,114.2254,順利邨公共圖書館順利邨公園兒童遊樂場入口對面,九龍觀塘順利邨公園停車場,順利邨,22.3291,114.2252,順利邨公園停車場曉光街2號曉光街體育館大堂,觀塘曉光街(曉麗苑對面),觀塘,22.3181,114.2304,曉光街休憩花園協和街33號裕民坊高層地下禮賓處,香港九龍協和街33號凱匯裕民坊商塲地下G6號舗,,22.3141,114.2244,7-11便利店觀塘駿業街56號中海日升中心一樓客服中心,九龍觀塘中海日升中心,,22.3112,114.2228,觀塘國語浸信會鴻圖道52號地下禮賓部,鴻圖道   52號,,22.3103,114.2222,鴻圖道52號海濱道181號One Harbour Square地下禮賓部,九龍觀塘海濱道83號OneBayEastCitiTower一樓E4號舖,,22.3159,114.2142,7-11便利店-海濱道83號觀塘道418號創世紀之城五期2樓寫字樓大堂禮賓部,九龍觀塘觀塘道418號創紀之城五期APM地下G02號舖,,22.3124,114.2254,7-11便利店-創紀之城第5期觀塘道418號創世紀之城五期大堂樓層客戶服務中心,九龍觀塘觀塘道418號創紀之城五期APM地下G02號舖,,22.3124,114.2254,7-11便利店-創紀之城第5期開源道49號創貿廣場1樓客戶服務中心,九龍觀塘開源道49號創貿廣場2305室,,22.3101,114.2238,半讀工房觀塘道426號觀塘消防局正門入口外,觀塘道   426號,,22.3119,114.2258,觀塘消防局安秀街23號安泰邨服務設施大樓4樓正門入口接待處,九龍觀塘安秀道23號安泰邨服務設施大樓四樓,秀茂坪,22.3256,114.2312,保良局安泰復康中心鴻圖道78號地下禮賓部,鴻圖道   78號,,22.3084,114.2239,鴻圖道78號偉業街223-231號宏利金融中心地下禮賓部,九龍觀塘偉業街223-231號宏利金融中心1樓14號舖,,22.3079,114.2234,7-11便利店-宏利金融中心翠屏道6號觀塘遊樂場7人人造草足球場簽到處,九龍觀塘月華街遊樂場,觀塘,22.3154,114.2265,月華街遊樂場鯉魚門道30號藍田救護站正門入口外,鯉魚門道   30號,油塘,22.3035,114.236,藍田救護站茜發道100號茜發道網球場入口,茜發道   100號,油塘,22.304,114.2344,茜發道網球場辦事處茜發道90號晒草灣遊樂場接待處,九龍九龍塘牛津道2A號地下(遊戲場 幼稚園辦公室／接待處 遊戲／音樂室)1樓(課室101-109 茶房 女洗手間男洗手間 走廊),,22.329,114.1812,啓思小學附屬幼稚園藍田碧雲道170號藍田（南）體育館辦事處,九龍藍田碧雲道170號,藍田,22.304,114.239,藍田(南)體育館藍田廣田邨保良局蕭明紀念護老院,九龍藍田廣田邨廣軒樓及廣雅樓地下及1字樓,藍田,22.3033,114.2399,保良局蕭明紀念護老院藍田站大堂（近客服中心）,九龍藍田香港鐵路藍田站,藍田,22.3071,114.2318,港鐵藍田站-D1進出口藍田站2號月台（近第四卡）,安域道   2號,九龍塘,22.3428,114.1781,映月臺油塘道9號油麗商場地下樓層客戶服務台,九龍油塘油塘道9號油麗商場地下一號鋪,油塘,22.2984,114.2372,百佳超級市場-油麗商場油塘站3號月台近第三卡,香港大潭大潭水塘道88號陽明山莊第三層,,22.258,114.1992,卡啦OK酒廊油塘站大堂近客服中心,九龍油塘香港鐵路油塘站,油塘,22.298,114.237,港鐵油塘站油塘消防局正門入口外,鴨脷洲消防局,鴨脷洲,22.2433,114.1522,鴨脷洲消防局藍田公園公園辦事處,地政總署清拆（一）辦事處（港島分處）,跑馬地,22.2717,114.189,地政總署清拆(-)辦事處(港島分處)油塘高超道38號大本型地下樓層客服中心服務台,九龍油塘高超道38號大本型地下低層一樓電梯大堂,油塘,22.2962,114.2388,大本型智郵站油塘鯉魚門廣場1樓123-124舖惠康近收銀位置,九龍油塘鯉魚門廣場2樓212A號舖,油塘,22.2971,114.2392,7-11便利店-鯉魚門廣場藍田消防局正門入口外,鴨脷洲消防局,鴨脷洲,22.2433,114.1522,鴨脷洲消防局油塘茶果嶺道三家村遊樂場公園辦事處,觀塘 茶果嶺道,鯉魚門,22.3097,114.2284,茶果嶺道 (KX 2956)(室外)香港皇后大道西470號石塘咀體育館近6樓入口處,青衣西南體育館,青衣,22.3515,114.1021,青衣西南體育館油塘高超道32號金門地盤B閘華榮路入口,九龍油塘高超道高怡邨高遠樓地下一號,油塘,22.2973,114.242,高超道仁愛敬老中心鯉魚門徑6號鯉魚門市政大廈二樓體育館大堂,九龍油塘鯉魚門徑6號鯉魚門市政大廈,油塘,22.2919,114.2388,鯉魚門市政大廈(體育館)觀塘秀茂坪購物商場1樓102舖惠康近收銀位置,觀塘秀茂坪村秀茂坪購物商場1樓102 舖,秀茂坪,22.319,114.2324,惠康超級廣場-秀茂坪廣場新界大埔安邦路8及10號大埔超級城C區,新界大埔安邦路8及10號,大埔,22.4527,114.171,大埔超級城C區九龍藍田啟田道 99 號藍田分科診所 2 樓藍田學童牙科診所,九龍藍田啟田道99號藍田分科診所2字樓,藍田,22.3106,114.2333,藍田學童牙科診所九龍灣健康中心普通門診診所,粉嶺壁峰路2號粉嶺健康中心3樓,粉嶺,22.4966,114.1388,粉嶺健康中心牙科診所牛頭角公共圖書館,牛頭角道   183號,牛頭角,22.3211,114.2162,牛頭角公共圖書館港鐵總部大樓,偉業街   33號,九龍灣,22.321,114.2135,港鐵總部大樓牛頭角定安街60號牛頭角賽馬會診所,九龍牛頭角定安街60號牛頭角賽馬會診所4樓,,22.3171,114.217,基督教家庭服務中心 - 香港中文大學中醫診所暨教研中心(觀塘區)佐敦谷游泳池,九龍牛頭角佐敦谷游泳池,牛頭角,22.3234,114.2179,佐敦谷游泳池停車場(室外)彩雲商場第二期2樓A206號舖 香港賽馬會場外投注處,九龍牛池灣彩雲(一)邨彩雲商場二期UG層A116號舖,牛池灣,22.3329,114.2147,7-11便利店-彩雲商場2期牛池灣文娛中心,牛池灣市政大廈,牛池灣,22.3345,114.2089,牛池灣文娛中心藍田長者健康中心,九龍藍田碧雲道223號藍田社區綜合大樓地下,藍田,22.3085,114.2395,藍田長者健康中心